Title,Address,City,Price,Bedroom,Bathroom,Floors,Parking,Face,Year,Views,Area,Road,Road Width,Road Type,Build Area,Posted,Amenities,Area_Aana,PricePerAana
"Land For Sale In Sallaghari, Bhaktapur","Sallaghari, Sallaghari, Bhaktapur",Bhaktapur,2000000,0,0,,0,East,,340,4.5 Aana,15 Feet / Soil Stabilized,15 Feet , Soil Stabilized,N/A Aana,10 months ago,[],4.0,500000.0
"Office Space For Rent In Kapan, Kathmandu","Kapan, Narayan Chowk, Kapan, Kathmandu",Kathmandu,30000,0,0,,0,North,,281,1000 Sq. Feet,0 Feet,0 Feet,,N/A Aana,10 months ago,[],2.9218407596785974,10267.5
"Flat For Rent In Satdobato, Lalitpur","Satdobato, Near BNB Hospital, Satdobato, Lalitpur",Lalitpur,22000,3,2,,2,West,,653,1300 Sq. Feet,15 Feet / Blacktopped,15 Feet , Blacktopped,N/A Aana,10 months ago,['Garage'],3.7983929875821767,5791.923076923077
"Flat For Rent In Ranibari, Kathmandu","Samakhusi, Ranibari, Kathmandu",Kathmandu,20000,2,1,,2,East,,505,800 Sq. Feet,15 Feet / Gravelled,15 Feet , Gravelled,N/A Sq. Feet,10 months ago,['Garage'],2.337472607742878,8556.25
"Land For Sale In Sanobharyang, Kathmandu","Sanobharyang, Sanobharyang, Kathmandu",Kathmandu,4200000,0,0,,0,East,,295,11 Aana,20 Feet / Blacktopped,20 Feet , Blacktopped,N/A Aana,10 months ago,[],11.0,381818.1818181818
"House For Sale In Dhulikhel, Kavre","Dhulikhel near KU, Dhulikhel, Kavre",Kavre,15200000,11,2,3.0,2,South,2018.0,352,817 Sq. Feet,10 Feet / Gravelled,10 Feet , Gravelled,0-4-0-2 Aana,10 months ago,"['Water Well', 'TV Cable', 'Water Supply', 'Wifi', 'Garage', 'Balcony', 'Fencing', 'Garden']",2.387143900657414,6367441.860465117
"A Newly House Built In A Nice And Quiet Residential Area On Sale : House For Sale In Basbari, Kathmandu","Hepali height, Basbari, Kathmandu",Kathmandu,45000000,4,0,,2,South,2018.0,441,7-0-2 Aana,20 Feet / Paved,20 Feet , Paved,N/A Aana,10 months ago,"['Lawn', 'Backyard', 'Balcony', 'Frontyard', 'Fencing', 'Garden', 'Drainage', 'Water Supply', 'Modular Kitchen', 'Air Condition', 'TV Cable', 'Washing Machine', 'Solar Water', 'Water Tank']",7.0,6428571.428571428
"House For Sale In Budhanilkantha, Kathmandu","Siddhartha Colony, Budhanilkantha, Kathmandu",Kathmandu,57500000,4,6,3.0,0,South,,635,7 Aana,20 Feet,20 Feet,,N/A Sq. Feet,10 months ago,"['Balcony', 'Garden', 'Modular Kitchen', 'TV Cable', 'Wifi', 'Drainage', 'Water Supply', 'Water Tank']",7.0,8214285.714285715
"Business For Sale In Gwarko, Lalitpur","Gwarko, Gwarko, Lalitpur",Lalitpur,600000,0,0,,0,South,,182,500 Sq. Feet,15 Feet / Blacktopped,15 Feet , Blacktopped,N/A Aana,10 months ago,[],1.4609203798392987,410700.0
"House For Rent In Baluwatar, Kathmandu","Baluwatar, Baluwatar, Kathmandu",Kathmandu,175000,4,3,2.0,3,North,,333,12 Aana,13 Feet,13 Feet,,N/A Sq. Feet,10 months ago,"['Balcony', 'TV Cable', 'Wifi', 'Drainage', 'Water Supply', 'Water Tank']",12.0,14583.333333333334
"Business For Sale In Kupondole, Lalitpur","Kupondole, Kupondole, Lalitpur",Lalitpur,700000,0,0,,0,North,,244,600 Sq. Feet,15 Feet / Blacktopped,15 Feet , Blacktopped,N/A Aana,10 months ago,"['Wifi', 'Water Supply', 'Modular Kitchen']",1.7531044558071585,399291.6666666667
"Land For Sale In Kavresthali, Kathmandu","Kavresthali, Kavresthali, Kathmandu",Kathmandu,1350000,0,0,,0,North,,262,0-2-5-0 Aana,15 Feet / Soil Stabilized,15 Feet , Soil Stabilized,N/A Aana,10 months ago,[],0.8125,1661538.4615384615
"House For Sale In Dallu : House For Sale In Dallu, Kathmandu","Dallu, Dallu, Kathmandu",Kathmandu,29000000,8,4,3.0,1,West,2071.0,457,0-3-1-2 Aana,20 Feet / Blacktopped,20 Feet , Blacktopped,N/A Aana,10 months ago,"['Balcony', 'Water Well', 'Water Tank', 'Solar Water']",0.84375,34370370.37037037
"House For Sale In Budhanilkantha, Kathmandu","Bhangal, Sundarbasti, Budhanilkantha, Kathmandu",Kathmandu,17800000,7,0,2.0,0,North,,627,0-3-1-0 Aana,15 Feet / Gravelled,15 Feet , Gravelled,N/A Sq. Feet,10 months ago,"['Balcony', 'TV Cable', 'Wifi', 'Drainage', 'Water Supply', 'Water Tank']",0.8125,21907692.307692308
"House For Sale In Golfutar, Kathmandu","Golfutar, Golfutar, Kathmandu",Kathmandu,29000000,5,3,2.5,0,South West,,437,4 Aana,15 Feet / Blacktopped,15 Feet , Blacktopped,N/A Sq. Feet,10 months ago,"['Balcony', 'TV Cable', 'Wifi', 'Drainage', 'Water Supply', 'Water Tank']",4.0,7250000.0
"Land For Sale In Chapali, Kathmandu","Chapali, Chapali, Kathmandu",Kathmandu,2100000,0,0,,0,West,,294,2-13-0-0 Ropani,16 Feet,16 Feet,,N/A Sq. Feet,10 months ago,[],32.0,65625.0
"Bungmati : Land For Sale In Bhaisepati, Lalitpur","Bhainsepati, Lalitpur, Bhaisepati, Lalitpur",Lalitpur,9000000,0,0,,0,East,,472,0-3-2-0 Aana,12 Feet / Gravelled,12 Feet , Gravelled,N/A Aana,10 months ago,[],0.875,10285714.285714285
"House At Lazimpat : House For Rent In Lazimpat, Kathmandu","Kholagal Marg Near Uttar Dhoka Marg, (North of Narayanhiti Sangrahalaya), Lazimpat, Kathmandu",Kathmandu,400000,5,4,3.0,4,South West,2044.0,511,25 Aana,16 Feet / Blacktopped,16 Feet , Blacktopped,About 4000 Sq. Feet,10 months ago,"['Balcony', 'Garden', 'Water Supply', 'TV Cable', 'Water Well', 'Lawn', 'Frontyard', 'Fencing', 'Wifi', 'Backyard', 'Modular Kitchen', 'Solar Water', 'Deck', 'Drainage', 'Water Tank']",25.0,16000.0
"Business For Sale In Baneshwor, Kathmandu","Himalayan Bank Building, Baneshwor, Kathmandu",Kathmandu,2500000,0,0,,0,North,,242,420 Sq. Feet,15 Feet / Blacktopped,15 Feet , Blacktopped,N/A Sq. Feet,10 months ago,[],1.227173119065011,2037202.3809523808
"Land For Sale In Budhanilkantha, Kathmandu","Hepali Height, Budhanilkantha, Kathmandu",Kathmandu,4100000,0,0,,0,West,,287,10 Aana,15 Feet / Soil Stabilized,15 Feet , Soil Stabilized,N/A Sq. Feet,10 months ago,[],10.0,410000.0
"House For Sale In Mandikatar, Kathmandu","Mandikatar Height, Mandikatar, Kathmandu",Kathmandu,51000000,0,0,3.0,0,South,,464,8 Aana,15 Feet / Blacktopped,15 Feet , Blacktopped,N/A Sq. Feet,10 months ago,"['Balcony', 'Garden', 'TV Cable', 'Wifi', 'Drainage', 'Water Supply', 'Solar Water', 'Water Tank']",8.0,6375000.0
"Land For Sale In Dhangadhi, Kailali","Dhangadhi, Kailali, Dhangadhi, Kailali",Kailali,6700000,0,0,,0,East,,396,12 Dhur,33 Feet / Blacktopped,33 Feet , Blacktopped,N/A Aana,10 months ago,[],4.0680000000000005,1647000.9832841689
"Balaju Tenpepale : Land For Sale In Balaju, Kathmandu","Balaju tenpepale ktm., Balaju, Kathmandu",Kathmandu,550000,0,0,,0,East,,393,5-0-0-0 Ropani,9 Meter / Blacktopped,9 Meter , Blacktopped,5-0-0-0 Ropani,10 months ago,[],80.0,6875.0
"Under Construction Bungalow : House For Sale In Budhanilkantha, Kathmandu","Budhanilkantha, Muhanpokhari, Budhanilkantha, Kathmandu",Kathmandu,29000000,0,0,3.0,0,North East,2076.0,1.3K,0-5-0-3 Aana,20 Feet / Gravelled,20 Feet , Gravelled,N/A Aana,10 months ago,"['Modular Kitchen', 'Solar Water', 'TV Cable', 'Water Tank', 'Frontyard', 'Fencing', 'Water Supply', 'Balcony']",1.296875,22361445.78313253
"Balkot 4 Anna 2 Paisa 1 Daam : Land For Sale In Balkot, Bhaktapur","Balkot Bkaktapur, Balkot, Bhaktapur",Bhaktapur,1900000,0,0,,0,East,,457,0-4-2-1 Aana,13 Feet / Gravelled,13 Feet , Gravelled,0-4-2-1 Aana,10 months ago,[],1.140625,1665753.4246575343
"House For Sale In Basundhara, Kathmandu","Basundhara, Basundhara, Kathmandu",Kathmandu,26500000,0,0,3.0,0,East,,439,3.5 Aana,12 Feet,12 Feet,,N/A Sq. Feet,10 months ago,"['Balcony', 'TV Cable', 'Drainage', 'Water Supply', 'Water Tank']",3.0,8833333.333333334
"New House : House For Sale In Mahendrapul, Pokhara","Pokhara -11 ranipauwa, Mahendrapul, Pokhara",Pokhara,36500000,0,0,3.0,0,East,2074.0,509,6.5 Aana,20 Feet / Gravelled,20 Feet , Gravelled,6.5 Aana,10 months ago,"['Garage', 'Garden', 'Wifi', 'Water Supply', 'TV Cable', 'Solar Water', 'Water Well', 'Water Tank', 'Washing Machine', 'Balcony', 'Fencing', 'Backyard', 'Gym', 'Frontyard', 'Modular Kitchen']",6.0,6083333.333333333
"Swarsati Kunj : House For Sale In Balkhu, Kathmandu","Balkhu, Balkhu, Kathmandu",Kathmandu,41000000,0,0,3.0,0,East,2075.0,457,4 Aana,12 Feet / Blacktopped,12 Feet , Blacktopped,750 Sq. Feet,10 months ago,"['Balcony', 'Wifi', 'Fencing', 'Drainage', 'Solar Water', 'Washing Machine', 'Garden', 'Water Supply', 'TV Cable', 'Water Tank']",4.0,10250000.0
"Badhikhel Lalitpurma 6 Roppani 8 Aana Jagga Bikrima Total Price 4 Crore : Land For Sale In Godawari, Lalitpur","Badikhel, godawari, Godawari, Lalitpur",Lalitpur,40000000,0,0,,0,East,,383,6-8-0-0 Aana,13 Feet / Gravelled,13 Feet , Gravelled,N/A Aana,10 months ago,[],8.0,5000000.0
"Land For Sale In Pokhara, Pokhara","Hemja, Milan Chowk-8, Pokhara, Pokhara, Pokhara",Pokhara,5600000,0,0,,0,East,,1.2K,8-2-0-0 Ropani,14 Feet / Soil Stabilized,14 Feet , Soil Stabilized,8-2-0-0 Ropani,10 months ago,[],128.0,43750.0
"PD1-101, A Apartments : Flat For Rent In Patandokha, Lalitpur","Patan Dhoka, Patandokha, Lalitpur",Lalitpur,40000,0,0,,0,South,,631,500 Sq. Feet,20 Feet / Blacktopped,20 Feet , Blacktopped,N/A Aana,10 months ago,"['Water Supply', 'Microwave', 'Washing Machine', 'Wifi', 'Solar Water', 'Water Tank']",1.4609203798392987,27380.0
"House For Sale In Basundhara, Kathmandu","Basundhara, Basundhara, Kathmandu",Kathmandu,30000000,0,0,3.0,0,East,,508,6 Aana,12 Feet,12 Feet,,N/A Sq. Feet,10 months ago,"['Balcony', 'TV Cable', 'Drainage', 'Water Supply', 'Water Tank']",6.0,5000000.0
"House For Sale In Tokha, Kathmandu","Bhutkhel Park, Tokha, Kathmandu",Kathmandu,14200000,4,2,2.0,0,West,,430,0-3-1-0 Aana,13 Feet,13 Feet,,N/A Sq. Feet,10 months ago,"['Balcony', 'TV Cable', 'Drainage', 'Water Supply', 'Water Tank']",0.8125,17476923.076923076
"Land For Sale In Samakhusi, Kathmandu","Nearby Samakhusi Town Planning, Samakhusi, Kathmandu",Kathmandu,5500000,0,0,,0,West,,264,8 Aana,13 Feet,13 Feet,,N/A Sq. Feet,10 months ago,[],8.0,687500.0
"Land For Sale In Jagati, Bhaktapur","Sipadol, Jagati, Bhaktapur",Bhaktapur,1700000,0,0,,0,South,,288,3 Aana,15 Feet / Soil Stabilized,15 Feet , Soil Stabilized,N/A Sq. Feet,10 months ago,[],3.0,566666.6666666666
"Business For Sale In Pulchowk, Lalitpur","Nearby Everest Bank, Pulchowk, Lalitpur",Lalitpur,3200000,0,0,,0,North,,181,700 Sq. Feet,15 Feet / Blacktopped,15 Feet , Blacktopped,N/A Sq. Feet,10 months ago,[],2.0452885317750185,1564571.4285714284
"House For Sale In Dhapasi, Kathmandu","Nearby Grande International Hospital, Dhapasi, Kathmandu",Kathmandu,17500000,0,0,3.0,0,North East,,1.2K,3.5 Aana,13 Feet,13 Feet,,N/A Sq. Feet,10 months ago,"['Balcony', 'TV Cable', 'Drainage', 'Water Supply', 'Water Tank']",3.0,5833333.333333333
"House For Sale In Hadigaun, Kathmandu","Hadigaun, Hadigaun, Kathmandu",Kathmandu,20000000,0,0,2.0,0,South,,523,4 Aana,13 Feet / Blacktopped,13 Feet , Blacktopped,N/A Sq. Feet,10 months ago,"['Balcony', 'TV Cable', 'Wifi', 'Drainage', 'Water Supply', 'Water Tank']",4.0,5000000.0
"Land For Sale In Chundevi, Kathmandu","Chundevi, Chundevi, Kathmandu",Kathmandu,2000000,0,0,,0,South East,,328,10 Aana,13 Feet,13 Feet,,N/A Sq. Feet,10 months ago,[],10.0,200000.0
"Land For Sale In Baluwatar, Kathmandu","Tudaldevi Mandir, Baluwatar, Kathmandu",Kathmandu,3800000,0,0,,0,East,,518,5 Sq. Feet,13 Feet / Gravelled,13 Feet , Gravelled,N/A Sq. Feet,10 months ago,[],0.014609203798392988,260110000.0
"Radha Bhawan : Office Space For Sale In Tripureshwor, Kathmandu","5th floor, Radha Bhawan, Opposite UWTC, first left from Tripureshwor chowk towards teku., Tripureshwor, Kathmandu",Kathmandu,20000,0,1,,2,North West,,376,1450 Sq. Feet,36 Feet,36 Feet,,1850 Sq. Feet,10 months ago,"['Water Supply', 'Parking', 'Drainage', 'Solar Water', 'Water Well', 'CCTV', 'Lift', 'Electricity Backup']",4.236669101533966,4720.689655172414
"Land For Sale In Gongabu, Kathmandu","Gongabu, Gongabu, Kathmandu",Kathmandu,3000000,0,0,,0,South East,,297,0-9-0-0 Aana,9 Feet / Blacktopped,9 Feet , Blacktopped,N/A Aana,10 months ago,[],2.25,1333333.3333333333
"House For Sale In Kapan, Kathmandu","Kapan, Kapan, Kathmandu",Kathmandu,15000000,2,1,1.0,0,South,,514,5 Aana,11 Feet,11 Feet,,N/A Sq. Feet,10 months ago,"['TV Cable', 'Drainage', 'Water Supply', 'Water Tank']",5.0,3000000.0
"House For Sale In Chhauni, Kathmandu","Nearby, Musiam, Chhauni, Kathmandu",Kathmandu,25000000,6,3,,0,North,,483,3.3.1 Aana,11 Feet / Blacktopped,11 Feet , Blacktopped,N/A Sq. Feet,10 months ago,"['Balcony', 'TV Cable', 'Wifi', 'Drainage', 'Water Supply', 'Solar Water', 'Water Tank']",3.0,8333333.333333333
"House For Sale In Baniyatar, Kathmandu","Baniyatar, Baniyatar, Kathmandu",Kathmandu,16500000,6,3,3.0,0,South,,468,3.1 Aana,10 Feet / Blacktopped,10 Feet , Blacktopped,N/A Sq. Feet,10 months ago,"['Balcony', 'TV Cable', 'Drainage', 'Water Supply', 'Water Tank']",3.0,5500000.0
"House For Sale In Tokha, Kathmandu","Opposite of Grandy Hospital, Tokha, Kathmandu",Kathmandu,53000000,6,4,3.0,3,West,,313,7.5 Aana,15 Feet / Blacktopped,15 Feet , Blacktopped,N/A Sq. Feet,10 months ago,"['Balcony', 'TV Cable', 'Wifi', 'Drainage', 'Water Supply', 'Solar Water', 'Water Tank']",7.0,7571428.571428572
"Land For Sale In Budhanilkantha, Kathmandu","Hepali Height, Budhanilkantha, Kathmandu",Kathmandu,3200000,0,0,,0,North,,363,5.5 Aana,13 Feet / Paved,13 Feet , Paved,N/A Sq. Feet,10 months ago,[],5.0,640000.0
"Land For Sale In Khusibu, Kathmandu","Khusibu Town Planning, Khusibu, Kathmandu",Kathmandu,5500000,0,0,,0,North,,406,7 Aana,20 Feet / Blacktopped,20 Feet , Blacktopped,N/A Sq. Feet,10 months ago,[],7.0,785714.2857142857
"Land For Sale In Hattigauda, Kathmandu","Ganesh Chowk, Hattigauda, Kathmandu",Kathmandu,3200000,0,0,,0,South East,,220,7 Aana,15 Feet / Soil Stabilized,15 Feet , Soil Stabilized,N/A Sq. Feet,10 months ago,[],7.0,457142.85714285716
"Land For Sale In Hattigauda, Kathmandu","Hattigauda, Hattigauda, Kathmandu",Kathmandu,2550000,0,0,,0,North,,276,16.5 Aana,15 Feet / Soil Stabilized,15 Feet , Soil Stabilized,N/A Sq. Feet,10 months ago,[],16.0,159375.0
"Land For Sale In Dadikot, Bhaktapur","Dadikot, Dadikot, Bhaktapur",Bhaktapur,1350000,0,0,,0,West,,260,3.2 Aana,13 Feet / Soil Stabilized,13 Feet , Soil Stabilized,N/A Sq. Feet,10 months ago,[],3.0,450000.0
"Land For Sale In Mulpani, Kathmandu","Mulpani, Mulpani, Kathmandu",Kathmandu,3200000,0,0,,0,West,,290,2.2 Aana,6 Meter / Concrete,6 Meter , Concrete,N/A Sq. Feet,10 months ago,[],2.0,1600000.0
"House For Sale In Tokha, Kathmandu","Grande, Tokha, Kathmandu",Kathmandu,43000000,6,5,3.0,3,South East,2074.0,403,8 Aana,12 Feet / Gravelled,12 Feet , Gravelled,5 Aana,10 months ago,"['Garage', 'Backyard', 'Balcony', 'Frontyard', 'Garden', 'Modular Kitchen', 'Swimming Pool', 'Washing Machine', 'Wifi', 'Drainage', 'Water Supply', 'Solar Water', 'Water Tank']",8.0,5375000.0
"House For Sale : House For Sale In Bhaktapur, Bhaktapur","bhaktapur, Bhaktapur, Bhaktapur",Bhaktapur,21500000,9,1,3.0,1,West,2076.0,633,0-6-0-0 Aana,20 Feet,20 Feet,,0-3-0-0 Aana,10 months ago,['Garage'],1.5,14333333.333333334
"House For Sale In Itahari, Sunsari","Halgada, Itahari, Sunsari",Sunsari,6400000,3,1,1.0,0,North,,905,6 Dhur,15 Feet / Soil Stabilized,15 Feet , Soil Stabilized,N/A Sq. Feet,10 months ago,"['TV Cable', 'Drainage', 'Water Supply', 'Water Tank']",2.0340000000000003,3146509.341199606
"Chandol Kanchan Housing : Land For Sale In Chandol, Kathmandu","Chandol kathmandu, Chandol, Kathmandu",Kathmandu,4300000,0,0,,0,South,,399,1-4-0-0 Aana,14 Feet / Blacktopped,14 Feet , Blacktopped,1-4-0-0 Aana,10 months ago,[],2.0,2150000.0
"Chandol House : House For Sale In Chandol, Kathmandu","Chandol Kathmandu, Chandol, Kathmandu",Kathmandu,24500000,4,3,2.0,2,East,2073.0,556,0-3-2-0 Aana,4 Meter / Soil Stabilized,4 Meter , Soil Stabilized,0-3-2-0 Aana,10 months ago,"['Garage', 'Garden', 'Water Supply', 'TV Cable', 'Solar Water', 'Water Tank', 'Modular Kitchen']",0.875,28000000.0
"Land : Land For Sale In Bhaisepati, Lalitpur","Bhaisepati ,Lalitpur, Bhaisepati, Lalitpur",Lalitpur,3600000,0,0,,0,South,,511,4 Aana,12 Feet,12 Feet,,N/A Aana,11 months ago,[],4.0,900000.0
"Chitwanma Sasto Ghaderi : Land For Sale In Chitrawan, Chitwan","Bharatpur 14 chitwan, Chitrawan, Chitwan",Chitwan,3800000,0,0,,0,West,,595,20 Dhur,9 Meter / Blacktopped,9 Meter , Blacktopped,N/A Dhur,11 months ago,"['Wifi', 'Water Supply', 'TV Cable']",6.78,560471.9764011799
"Land For Sale In Baluwatar, Kathmandu","Tudaldevi, Baluwatar, Kathmandu",Kathmandu,3600000,0,0,,0,North,,643,13 Aana,10 Feet / Gravelled,10 Feet , Gravelled,N/A Sq. Feet,11 months ago,[],13.0,276923.07692307694
"House For Sale In Bharatpur, Chitwan","2, Bharatpur, Chitwan",Chitwan,23000000,15,6,3.0,10,North,2075.0,363,10 Dhur,20 Feet / Blacktopped,20 Feet , Blacktopped,10 Dhur,11 months ago,"['Garage', 'Balcony', 'Fencing', 'TV Cable', 'Wifi', 'Water Supply', 'Water Tank']",3.39,6784660.766961652
"House For Sale In Baluwatar, Kathmandu","Near PM Quarter, Baluwatar, Kathmandu",Kathmandu,33500000,0,0,3.0,1,East,,1K,5 Aana,20 Feet / Blacktopped,20 Feet , Blacktopped,N/A Sq. Feet,11 months ago,"['Balcony', 'TV Cable', 'Drainage', 'Water Supply', 'Water Tank']",5.0,6700000.0
"House For Sale In Baniyatar, Kathmandu","Baniyatar, Baniyatar, Kathmandu",Kathmandu,32000000,9,4,,0,East,,342,5 Aana,10 Feet / Blacktopped,10 Feet , Blacktopped,N/A Sq. Feet,11 months ago,"['Balcony', 'TV Cable', 'Wifi', 'Drainage', 'Water Supply', 'Solar Water', 'Water Tank']",5.0,6400000.0
"House For Sale In Jorpati, Kathmandu","Jorpati, Jorpati, Kathmandu",Kathmandu,14000000,0,0,3.0,1,East,,444,2.5 Aana,10 Feet,10 Feet,,N/A Sq. Feet,11 months ago,"['Balcony', 'TV Cable', 'Drainage', 'Water Supply', 'Water Tank']",2.0,7000000.0
"House For Sale In Baniyatar, Kathmandu","Baniyatar, Baniyatar, Kathmandu",Kathmandu,35000000,10,3,3.0,0,North,,265,4 Aana,16 Feet / Blacktopped,16 Feet , Blacktopped,N/A Sq. Feet,11 months ago,"['Balcony', 'TV Cable', 'Wifi', 'Drainage', 'Water Supply', 'Water Tank']",4.0,8750000.0
"House For Sale In Nakkhu, Lalitpur","Nearby of Medicity Hospital, Nakkhu, Lalitpur",Lalitpur,25500000,4,4,2.5,0,North West,,755,4.2 Aana,14 Feet / Gravelled,14 Feet , Gravelled,N/A Sq. Feet,11 months ago,"['Balcony', 'TV Cable', 'Wifi', 'Drainage', 'Water Supply', 'Solar Water', 'Water Tank']",4.0,6375000.0
"House For Sale In Thasikhel, Lalitpur","Shabyatanagar, Lalitpur, Thasikhel, Lalitpur",Lalitpur,24000000,12,4,3.0,4,South East,,303,4 Aana,0 Feet,0 Feet,,4 Aana,11 months ago,"['Water Supply', 'Balcony', 'Water Well', 'Fencing', 'TV Cable', 'Wifi', 'Drainage']",4.0,6000000.0
"House For Sale In Dhapasi, Kathmandu","Dhapashi, Basundhara, Tokha - 5, Dhapasi, Kathmandu",Kathmandu,18700000,1,1,3.0,1,East,,412,0-5-1-0 Aana,7 Feet,7 Feet,,0-3-0-0 Aana,11 months ago,"['Backyard', 'Water Supply', 'Drainage', 'Garden', 'Fencing', 'Water Well']",1.3125,14247619.047619049
"Flat For Rent In Sankhamul, Kathmandu","Newbaneshwar , Radhamarga, Sankhamul, Kathmandu",Kathmandu,19500,0,0,,0,East,,646,800 Sq. Feet,0 Feet,0 Feet,,N/A Aana,11 months ago,[],2.337472607742878,8342.34375
"Attractive Land In Kirtipur : Land For Sale In Kirtipur, Kirtipur","Bhutkhel, Kirtipur, Kathmandu",Kathmandu,1600000,0,0,,0,East,,257,28 Aana,20 Feet / Gravelled,20 Feet , Gravelled,28 Aana,11 months ago,[],28.0,57142.857142857145
"House For Sale In Imadol, Lalitpur","Near Buddha Party Palace, Imadol, Lalitpur",Lalitpur,16500000,5,3,3.0,0,South,,635,3.5 Aana,13 Feet / Blacktopped,13 Feet , Blacktopped,N/A Sq. Feet,11 months ago,"['Balcony', 'TV Cable', 'Wifi', 'Drainage', 'Water Supply', 'Water Tank']",3.0,5500000.0
"Land For Sale In Gokarneshwor, Kathmandu","Nearby, Baluwa Gaabisa, Gokarneshwor, Kathmandu",Kathmandu,750000,0,0,,0,West,,375,4 Aana,13 Feet / Soil Stabilized,13 Feet , Soil Stabilized,N/A Sq. Feet,11 months ago,[],4.0,187500.0
"Land For Sale In Lubhu, Lalitpur","Lubhu, Lubhu, Lalitpur",Lalitpur,1250000,0,0,,0,North,,300,5 Ropani,20 Feet,20 Feet,,N/A Sq. Feet,11 months ago,[],80.0,15625.0
"House For Sale In Hadigaun, Kathmandu","Hadigaun, Hadigaun, Kathmandu",Kathmandu,25000000,0,0,4.0,0,West,,323,3 Aana,13 Feet,13 Feet,,N/A Sq. Feet,11 months ago,"['Balcony', 'TV Cable', 'Drainage', 'Water Supply', 'Water Tank']",3.0,8333333.333333333
"House For Sale In Sukedhara, Kathmandu","Sukedhara, Sukedhara, Kathmandu",Kathmandu,31800000,10,0,3.0,0,East,,473,5.1 Aana,14 Feet / Blacktopped,14 Feet , Blacktopped,N/A Sq. Feet,11 months ago,"['Balcony', 'TV Cable', 'Wifi', 'Drainage', 'Water Supply', 'Water Tank']",5.0,6360000.0
"Land For Sale In Hattigauda, Kathmandu","Hattigauda, Hattigauda, Kathmandu",Kathmandu,2500000,0,0,,0,South,,346,9 Aana,15 Feet / Soil Stabilized,15 Feet , Soil Stabilized,N/A Sq. Feet,11 months ago,[],9.0,277777.77777777775
"House For Sale In Sukedhara, Kathmandu","Sukedhara, Sukedhara, Kathmandu",Kathmandu,27500000,0,0,,0,North,,351,4 Aana,13 Feet / Gravelled,13 Feet , Gravelled,N/A Sq. Feet,11 months ago,[],4.0,6875000.0
"House For Sale In Tokha, Kathmandu","Greenland Chowk, Tokha, Kathmandu",Kathmandu,26000000,0,0,3.0,0,West,,309,4.1 Aana,15 Feet / Blacktopped,15 Feet , Blacktopped,N/A Sq. Feet,11 months ago,"['Balcony', 'TV Cable', 'Wifi', 'Drainage', 'Water Supply', 'Water Tank']",4.0,6500000.0
"Business For Sale In Pepsicola, Kathmandu","Nearby, Sunsite, Pepsicola, Kathmandu",Kathmandu,800000,0,0,,0,West,,216,600 Sq. Feet,15 Feet / Blacktopped,15 Feet , Blacktopped,N/A Sq. Feet,11 months ago,[],1.7531044558071585,456333.3333333334
"House For Sale In Satungal, Kathmandu","Satungal, Satungal, Kathmandu",Kathmandu,9500000,4,0,,0,South,,595,4 Aana,15 Feet / Soil Stabilized,15 Feet , Soil Stabilized,N/A Sq. Feet,11 months ago,"['TV Cable', 'Drainage', 'Water Supply', 'Water Tank']",4.0,2375000.0
"House For Sale In Kapan, Kathmandu","Aakashaydhara, Kapan, Kathmandu",Kathmandu,15000000,0,0,,0,West,,329,3 Aana,13 Feet / Blacktopped,13 Feet , Blacktopped,N/A Sq. Feet,11 months ago,"['Garden', 'TV Cable', 'Wifi', 'Drainage', 'Water Supply', 'Water Tank']",3.0,5000000.0
"House For Rent In Budhanilkantha, Kathmandu","italittar, Budhanilkantha, Kathmandu",Kathmandu,43000,4,3,,0,West,,399,2000 Sq. Feet,15 Feet / Blacktopped,15 Feet , Blacktopped,N/A Sq. Feet,11 months ago,"['Balcony', 'TV Cable', 'Drainage', 'Water Supply', 'Water Tank']",5.843681519357195,7358.375
"House For Sale In Budhanilkantha, Kathmandu","Hepali Height, Budhanilkantha, Kathmandu",Kathmandu,42500000,5,4,,0,South West,,2.9K,5.5 Aana,20 Feet,20 Feet,,N/A Sq. Feet,11 months ago,"['Balcony', 'TV Cable', 'Wifi', 'Drainage', 'Water Supply', 'Water Tank']",5.0,8500000.0
"Flat For Rent In Hattiban, Lalitpur","Nearby, Cancer Hospital, Hattiban, Lalitpur",Lalitpur,30000,0,0,,0,North,,885,800 Sq. Feet,15 Feet / Blacktopped,15 Feet , Blacktopped,N/A Sq. Feet,11 months ago,"['Balcony', 'TV Cable', 'Wifi', 'Drainage', 'Water Supply', 'Solar Water', 'Water Tank']",2.337472607742878,12834.375000000002
"Land For Sale In Suryabinayak, Bhaktapur","Suryabinayak, Suryabinayak, Bhaktapur",Bhaktapur,1675000,0,0,,0,East,,306,0-4-0-2 Aana,31 Feet,31 Feet,,N/A Sq. Feet,11 months ago,[],1.03125,1624242.4242424243
"Business For Sale In Kalimati, Kathmandu","Nearby Solti Hotel, Kalimati, Kathmandu",Kathmandu,6000000,0,0,,0,West,,214,700 Sq. Feet,15 Feet / Blacktopped,15 Feet , Blacktopped,N/A Sq. Feet,11 months ago,[],2.0452885317750185,2933571.428571428
"House For Sale In Tokha, Kathmandu","Mahadevtar, Tokha, Kathmandu",Kathmandu,60000000,0,0,3.0,3,East,,242,9 Aana,13 Feet,13 Feet,,N/A Sq. Feet,11 months ago,"['Balcony', 'TV Cable', 'Drainage', 'Water Supply', 'Water Tank']",9.0,6666666.666666667
"House For Sale In Tahachal, Kathmandu","Tahachal, Kathmandu, Tahachal, Kathmandu",Kathmandu,40000000,0,0,2.5,0,West,,354,6.1 Aana,20 Feet / Paved,20 Feet , Paved,3.5 Aana,11 months ago,[],6.0,6666666.666666667
"Bafal Kohinoor Housing Colony : House For Sale In Kalimati, Kathmandu","Purano Kalimati, Kalimati, Kathmandu",Kathmandu,29500000,0,0,,0,East,,430,0-3-3-0 Aana,0 Feet,0 Feet,,N/A Aana,11 months ago,[],0.9375,31466666.666666668
"House For Sale In Sukedhara, Kathmandu","Sukedhara, Sukedhara, Kathmandu",Kathmandu,19000000,3,2,2.0,0,South West,,1.1K,3.1 Aana,24 Feet / Blacktopped,24 Feet , Blacktopped,N/A Sq. Feet,11 months ago,"['Balcony', 'TV Cable', 'Wifi', 'Drainage', 'Water Supply', 'Water Tank']",3.0,6333333.333333333
"Land For Sale In Thapathali, Kathmandu","Behind Rastra Bank, Thapathali, Kathmandu",Kathmandu,7500000,0,0,,0,East,,282,12.5 Aana,18 Feet / Gravelled,18 Feet , Gravelled,N/A Sq. Feet,11 months ago,[],12.0,625000.0
"House For Sale In Basundhara, Kathmandu","Basundhara, Basundhara, Kathmandu",Kathmandu,32500000,4,3,,0,North West,,335,5.5 Aana,16 Feet / Gravelled,16 Feet , Gravelled,N/A Sq. Feet,11 months ago,"['Balcony', 'TV Cable', 'Wifi', 'Drainage', 'Water Supply', 'Water Tank']",5.0,6500000.0
"House For Sale In Bhaisepati, Lalitpur","Gokul Aawas, Bhaisepati, Lalitpur",Lalitpur,44500000,5,5,3.0,0,North,,641,6.5 Aana,16 Feet / Gravelled,16 Feet , Gravelled,N/A Sq. Feet,11 months ago,[],6.0,7416666.666666667
"House For Sale In Hattigauda, Kathmandu","Hattigauda, Hattigauda, Kathmandu",Kathmandu,32000000,5,4,3.0,0,South,,301,5 Aana,15 Feet / Gravelled,15 Feet , Gravelled,N/A Sq. Feet,11 months ago,"['Balcony', 'TV Cable', 'Wifi', 'Drainage', 'Water Supply', 'Solar Water', 'Water Tank']",5.0,6400000.0
"House For Sale In Golfutar, Kathmandu","Hepali, Golfutar, Kathmandu",Kathmandu,28500000,5,0,3.0,0,North East,,1.5K,4.1.1 Aana,12 Feet / Gravelled,12 Feet , Gravelled,N/A Sq. Feet,11 months ago,"['Balcony', 'TV Cable', 'Drainage', 'Water Supply', 'Water Tank']",4.0,7125000.0
"House For Sale In Basundhara, Kathmandu","Basundhara, Basundhara, Kathmandu",Kathmandu,26000000,5,3,3.0,0,East,,3.4K,4.3 Aana,12 Feet / Blacktopped,12 Feet , Blacktopped,N/A Sq. Feet,11 months ago,"['Balcony', 'TV Cable', 'Wifi', 'Drainage', 'Water Supply', 'Solar Water', 'Water Tank']",4.0,6500000.0
"Land For Sale In Hattigauda, Kathmandu","Hattigauda, Hattigauda, Kathmandu",Kathmandu,2800000,0,0,,0,West,,276,18 Aana,15 Feet / Soil Stabilized,15 Feet , Soil Stabilized,N/A Sq. Feet,11 months ago,[],18.0,155555.55555555556
