Title,Address,City,Price,Bedroom,Bathroom,Floors,Parking,Face,Year,Views,Area,Road,Road Width,Road Type,Build Area,Posted,Amenities,Area_Aana,PricePerAana
"Business For Rent In Jawalakhel, Lalitpur","Vianet Communications Pvt. Ltd., Jawalakhel, Lalitpur",Lalitpur,200000,0,0,,0,North,,1.2K,615 Sq. Feet,35 Feet / Blacktopped,35 Feet , Blacktopped,N/A Sq. Feet,8 months ago,[],1.7969320672023374,111300.81300813008
"House For Sale In Budhanilkantha, Kathmandu","Bhangal, Budhanilkantha, Kathmandu",Kathmandu,26200000,13,0,,0,West,,304,0-5-5-0 Aana,13 Feet / Blacktopped,13 Feet , Blacktopped,N/A Sq. Feet,8 months ago,[],1.5625,16768000.0
"House For Sale In Tathali, Kathmandu","Tathali, Tathali, Kathmandu",Kathmandu,4600000,0,0,1.0,0,North,,402,3 Aana,13 Feet / Soil Stabilized,13 Feet , Soil Stabilized,N/A Sq. Feet,8 months ago,[],3.0,1533333.3333333333
"Land For Sale In Lubhu, Lalitpur","Lubhu, Lubhu, Lalitpur",Lalitpur,1000000,0,0,,0,North,,424,5 Aana,17 Feet / Gravelled,17 Feet , Gravelled,N/A Aana,8 months ago,[],5.0,200000.0
"Urgent Sale 8 Aana Land At Gaushala : Land For Sale In Gaushala, Kathmandu","Gaushala, Gaushala, Kathmandu",Kathmandu,8500000,0,0,,0,South,,681,0-8-0-1 Aana,13 Feet / Blacktopped,13 Feet , Blacktopped,N/A Aana,8 months ago,[],2.015625,4217054.263565891
"Flat For Rent In Nagarjun, Kathmandu","Ramkot, Nagarjun, Kathmandu",Kathmandu,40000,0,2,,0,South,,161,1400 Sq. Feet,11 Meter / Gravelled,11 Meter , Gravelled,1400 Sq. Feet,8 months ago,[],4.090577063550037,9778.571428571428
"House For Sale Siddhartha Colony : House For Sale In Budhanilkantha, Kathmandu","Siddhartha Colony, Budhanilkantha, Kathmandu",Kathmandu,41000000,5,4,2.0,2,East,2073.0,2.2K,0-8-1-0 Aana,13 Feet / Blacktopped,13 Feet , Blacktopped,2500 Sq. Feet,8 months ago,[],2.0625,19878787.87878788
"Land For Sale In Mulpani, Kathmandu","Mulpani Kathamandu enginnering College, Mulpani, Kathmandu",Kathmandu,550000,0,0,,0,South East,,626,3-8-0-0 Ropani,20 Feet / Soil Stabilized,20 Feet , Soil Stabilized,N/A Sq. Feet,8 months ago,[],48.0,11458.333333333334
"House For Rent In Dhobighat, Lalitpur","Dhobighat Thadodhunga, Dhobighat, Lalitpur",Lalitpur,175000,0,0,,0,West,,272,2200 Sq. Feet,15 Feet / Blacktopped,15 Feet , Blacktopped,N/A Sq. Feet,8 months ago,[],6.428049671292914,27224.43181818182
"House For Sale In Basundhara, Kathmandu","Basundhara, Basundhara, Kathmandu",Kathmandu,42000000,11,0,,0,West,,251,7 Aana,15 Feet / Blacktopped,15 Feet , Blacktopped,N/A Sq. Feet,8 months ago,[],7.0,6000000.0
"House For Sale In Surkhet Bazar, Surkhet","Surkhet, Surkhet Bazar, Surkhet",Surkhet,20000000,0,0,,0,North,,420,162 Sq. Feet,20 Feet / Blacktopped,20 Feet , Blacktopped,N/A Sq. Feet,8 months ago,"['Balcony', 'TV Cable', 'Water Well', 'Parking']",0.4733382030679328,42253086.41975309
"Land For Sale In Kageshwari-Manohara, Kathmandu","Aalapot, Kageshwari-Manohara, Kathmandu",Kathmandu,2800000,0,0,,0,North,,218,5 Aana,10 Feet / Soil Stabilized,10 Feet , Soil Stabilized,N/A Sq. Feet,8 months ago,[],5.0,560000.0
"Land For Sale In Duwakot, Bhaktapur","KMC, Duwakot, Bhaktapur",Bhaktapur,1800000,0,0,,0,North,,241,30 Aana,20 Feet / Blacktopped,20 Feet , Blacktopped,N/A Sq. Feet,8 months ago,[],30.0,60000.0
"Land For Sale In Saraswatikhel, Bhaktapur","Saraswotikhel Bus Stop, Saraswatikhel, Bhaktapur",Bhaktapur,1300000,0,0,,0,West,,309,10 Aana,13 Feet / Gravelled,13 Feet , Gravelled,N/A Sq. Feet,8 months ago,[],10.0,130000.0
"Land For Sale In Chhauni, Kathmandu","Chhauni Military Barrack, Chhauni, Kathmandu",Kathmandu,2500000,0,0,,0,East,,298,0-3-3-0 Aana,10 Feet / Soil Stabilized,10 Feet , Soil Stabilized,N/A Aana,8 months ago,[],0.9375,2666666.6666666665
"House For Sale In Budhanilkantha, Kathmandu","Jyoti Nagar, Budhanilkantha, Kathmandu",Kathmandu,25500000,6,4,3.0,2,East,,288,4.5 Aana,13 Feet / Blacktopped,13 Feet , Blacktopped,4 Aana,8 months ago,['Garden'],4.0,6375000.0
"House For Sale In Kapan, Kathmandu","Kharibot Chowk Bus Stop, Kapan, Kathmandu",Kathmandu,15000000,0,0,,0,East,2073.0,414,3 Aana,10 Feet / Blacktopped,10 Feet , Blacktopped,N/A Aana,8 months ago,[],3.0,5000000.0
"KAPURDHARA NEW HOME : House For Sale In Kapurdhara, Kathmandu","Kapurdhara, Kapurdhara, Kathmandu",Kathmandu,32000000,5,5,,2,East,,489,4 Aana,13 Feet / Blacktopped,13 Feet , Blacktopped,N/A Aana,8 months ago,"['Modular Kitchen', 'Water Supply', 'Solar Water', 'TV Cable', 'Drainage', 'Balcony']",4.0,8000000.0
"House For Sale In Bharatpur, Chitwan","Bharatpur lanku -trichok, Bharatpur, Chitwan",Chitwan,5000000,0,0,,0,North,,378,6 Dhur,6 Meter / Gravelled,6 Meter , Gravelled,N/A Sq. Feet,8 months ago,[],2.0340000000000003,2458210.4228121922
"Stay In The Green : Land For Sale In Baghdol, Lalitpur","Awas, Magar Ghau, Shital Colony, Baghdol, Lalitpur",Lalitpur,2900000,0,0,0.0,0,South East,,251,4 Aana,22 Feet / Concrete,22 Feet , Concrete,N/A Sq. Feet,8 months ago,[],4.0,725000.0
"Land For Sale In Imadol, Lalitpur","Boje Pokhari, Imadol, Lalitpur",Lalitpur,2700000,0,0,,0,South,,290,0-3-1-0 Aana,10 Feet / Soil Stabilized,10 Feet , Soil Stabilized,N/A Sq. Feet,8 months ago,[],0.8125,3323076.923076923
"Flat For Rent In Kirtipur, Kirtipur","Kirtipur Sasa Newa The Restro, Kirtipur, Kathmandu",Kathmandu,15000,0,0,,0,West,,307,900 Sq. Feet,15 Feet / Gravelled,15 Feet , Gravelled,N/A Sq. Feet,8 months ago,[],2.6296566837107376,5704.166666666667
"House For Sale In Dadikot, Bhaktapur","Dadhikot, Dadikot, Bhaktapur",Bhaktapur,11500000,0,0,,0,North,,587,0-3-0-3 Aana,12 Feet / Gravelled,12 Feet , Gravelled,N/A Sq. Feet,8 months ago,[],0.796875,14431372.549019609
"Land For Sale In Goldhunga, Kathmandu","Goldhunga, Goldhunga, Kathmandu",Kathmandu,1500000,0,0,,0,South,,280,0-3-3-0 Aana,13 Feet / Gravelled,13 Feet , Gravelled,N/A Sq. Feet,8 months ago,[],0.9375,1600000.0
"Land For Sale In Chabahil, Kathmandu","Bhadrabas, Chabahil, Kathmandu",Kathmandu,1200000,0,0,,0,North,,455,0-4-2-3 Aana,20 Feet / Soil Stabilized,20 Feet , Soil Stabilized,N/A Sq. Feet,8 months ago,[],1.171875,1024000.0
"Land For Sale In Boudha, Kathmandu","Boudha Road Town planning, Boudha, Kathmandu",Kathmandu,5400000,0,0,,0,South,,256,4 Aana,6 Meter / Blacktopped,6 Meter , Blacktopped,N/A Sq. Feet,8 months ago,[],4.0,1350000.0
"House For Sale In Gothatar, Kathmandu","Mantar Chowk, Gothatar, Kathmandu",Kathmandu,14000000,8,0,3.0,0,West,,911,0-2-2-0 Aana,13 Feet / Gravelled,13 Feet , Gravelled,N/A Sq. Feet,8 months ago,[],0.625,22400000.0
"Office Space For Rent In Gyaneshwor, Kathmandu","Gyaneshwor, Gyaneshwor, Kathmandu",Kathmandu,250000,0,0,4.0,0,West,,1.5K,3000 Sq. Feet,20 Meter / Blacktopped,20 Meter , Blacktopped,N/A Sq. Feet,8 months ago,[],8.765522279035793,28520.833333333332
"House For Sale In Bharatpur, Chitwan","Tri Chowk bharatpur, Bharatpur, Chitwan",Chitwan,5000000,2,1,1.0,0,South,,278,6 Dhur,6 Meter / Blacktopped,6 Meter , Blacktopped,N/A Dhur,8 months ago,[],2.0340000000000003,2458210.4228121922
"House For Sale In Hattiban, Lalitpur","Little Angels School, Hattiban, Lalitpur",Lalitpur,49500000,0,0,,0,East,,11.9K,9 Aana,16 Feet / Blacktopped,16 Feet , Blacktopped,N/A Aana,8 months ago,[],9.0,5500000.0
"13 Anna Land On Sale At Balambu : Land For Sale In Balambu, Kathmandu","gurjhudhara, Balambu, Kathmandu",Kathmandu,1700000,0,0,,0,East,,233,13 Aana,16 Feet,16 Feet,,N/A Aana,8 months ago,[],13.0,130769.23076923077
"0-4-2-3 Anna Land On Sale At Baad Bhanjyang : Land For Sale In Chandragiri, Kathmandu","baad bhanjyang, Chandragiri, Kathmandu",Kathmandu,1100000,0,0,,0,North East,,301,0-4-2-3 Aana,13 Feet,13 Feet,,N/A Aana,8 months ago,[],1.171875,938666.6666666666
"Land On Sale At Gairidhara Kathmandu : Land For Sale In Gairidhara, Kathmandu","Gairidhara Road, Gairidhara, Kathmandu",Kathmandu,10000000,0,0,,0,East,,317,0-4-0-0 Aana,13 Feet / Blacktopped,13 Feet , Blacktopped,N/A Aana,8 months ago,[],1.0,10000000.0
"Land On Sale At Manbhawan Lalitpur : Land For Sale In Jawalakhel, Lalitpur","Lokeshwor Tole, Jawalakhel, Lalitpur",Lalitpur,8500000,0,0,,0,North West,,248,1-0-0-0 Aana,13 Feet / Blacktopped,13 Feet , Blacktopped,N/A Aana,8 months ago,[],1.0,8500000.0
"House For Sale In Goldhunga, Kathmandu","Goldhunga, Goldhunga, Kathmandu",Kathmandu,25000000,0,0,,0,North,,211,10 Sq. Feet,15 Feet,15 Feet,,N/A Sq. Feet,8 months ago,[],0.029218407596785977,855625000.0
"House For Sale In Dhading, Dhading","Dhading Mankamana tol, Dhading, Dhading",Dhading,9500000,0,0,2.0,0,North,,157,5 Aana,15 Feet / Soil Stabilized,15 Feet , Soil Stabilized,N/A Sq. Feet,8 months ago,[],5.0,1900000.0
"House For Sale In Kadaghari, Kathmandu","HarHar Mahadev Chowk, Kadaghari, Kathmandu",Kathmandu,17000000,5,2,3.0,1,East,2076.0,531,3 Aana,12 Feet / Blacktopped,12 Feet , Blacktopped,N/A Aana,8 months ago,"['Garage', 'Fencing', 'Water Tank']",3.0,5666666.666666667
"Flat For Rent In Lokanthali, Bhaktapur","Lokanthali, Lokanthali, Bhaktapur",Bhaktapur,18000,2,1,,0,North,,376,900 Sq. Feet,15 Feet / Gravelled,15 Feet , Gravelled,N/A Sq. Feet,8 months ago,[],2.6296566837107376,6845.000000000001
"Business For Rent In Pepsicola, Kathmandu","Pepsicola, Pepsicola, Kathmandu",Kathmandu,40000,0,0,,0,West,,301,800 Sq. Feet,15 Feet / Blacktopped,15 Feet , Blacktopped,N/A Sq. Feet,8 months ago,[],2.337472607742878,17112.5
"Flat For Rent In Pepsicola, Kathmandu","Pepsicola, Pepsicola, Kathmandu",Kathmandu,15000,1,1,,0,West,,583,700 Sq. Feet,15 Feet / Gravelled,15 Feet , Gravelled,N/A Sq. Feet,8 months ago,[],2.0452885317750185,7333.928571428571
"House For Sale In Imadol, Lalitpur","bhadrakali imadol, Imadol, Lalitpur",Lalitpur,10000000,2,2,1.0,1,North East,,3.1K,3 Aana,13 Feet / Blacktopped,13 Feet , Blacktopped,N/A Aana,8 months ago,"['TV Cable', 'Drainage', 'Water Supply', 'Water Well', 'Internet', 'Parking']",3.0,3333333.3333333335
"House For Sale In Imadol, Lalitpur","Imadol, way to tikathali, Imadol, Lalitpur",Lalitpur,30000000,9,5,4.0,3,North West,2076.0,919,0-3-2-0 Aana,33 Feet / Blacktopped,33 Feet , Blacktopped,0-3-0-0 Aana,8 months ago,"['Garage', 'Balcony', 'Store Room', 'Parking', 'Water Well', 'Water Tank']",0.875,34285714.28571428
"Land For Sale In Bhaisepati, Lalitpur","Bhaisepati, Bhaisepati, Lalitpur",Lalitpur,4500000,0,0,,0,West,,239,8 Aana,15 Feet / Gravelled,15 Feet , Gravelled,N/A Sq. Feet,8 months ago,[],8.0,562500.0
"Land For Sale In Sitapaila, Kathmandu","Nagarjun Municipality Office, Sitapaila, Kathmandu",Kathmandu,1200000,0,0,,0,South,,433,0-4-2-0 Aana,12 Feet / Gravelled,12 Feet , Gravelled,N/A Sq. Feet,8 months ago,[],1.125,1066666.6666666667
"Land For Sale In Naikap, Kathmandu","Purano Naikap, Naikap, Kathmandu",Kathmandu,1300000,0,0,,0,West,,1.4K,10 Aana,10 Feet / Soil Stabilized,10 Feet , Soil Stabilized,N/A Aana,8 months ago,[],10.0,130000.0
"Land For Sale In Naikap, Kathmandu","Purano Naikap, Naikap, Kathmandu",Kathmandu,1700000,0,0,,0,South,,3.4K,4 Aana,10 Feet / Soil Stabilized,10 Feet , Soil Stabilized,N/A Aana,8 months ago,[],4.0,425000.0
"Sukedhara, Jyotinagar House For Sell : House For Sale In Budhanilkantha, Kathmandu","Sukedhara, Jyoti Nagar, Budhanilkantha, Kathmandu",Kathmandu,22500000,0,3,3.0,2,East,,344,3.5 Aana,13 Feet / Paved,13 Feet , Paved,3 Aana,8 months ago,['Balcony'],3.0,7500000.0
"Land For Sale In Sanepa, Lalitpur","Everest Engineering College, Sanepa, Lalitpur",Lalitpur,5500000,0,0,,0,West,,690,8 Aana,15 Feet / Concrete,15 Feet , Concrete,N/A Aana,8 months ago,[],8.0,687500.0
"Land For Sale In Sanepa, Lalitpur","Chaudhary Group, Sanepa, Lalitpur",Lalitpur,7000000,0,0,,0,West,,688,11 Aana,15 Feet / Blacktopped,15 Feet , Blacktopped,N/A Aana,8 months ago,[],11.0,636363.6363636364
"Land For Sale In Sanepa, Lalitpur","Sanepa Heights Road, Sanepa, Lalitpur",Lalitpur,5500000,0,0,,0,West,,517,12 Aana,13 Feet / Concrete,13 Feet , Concrete,N/A Aana,8 months ago,[],12.0,458333.3333333333
"House For Sale In Kadaghari, Kathmandu","Hattidada Gothatar 9, Kadaghari, Kathmandu",Kathmandu,22000000,11,0,2.0,0,West,,351,5 Aana,15 Feet / Gravelled,15 Feet , Gravelled,N/A Sq. Feet,8 months ago,[],5.0,4400000.0
"Shivam Guest House : Land For Sale In Buddha Bhumi Nagarpalika, Kapilvastu","Near Shree Laxmi Narayan Rd, Krishnanagar, Buddha Bhumi Nagarpalika, Kapilvastu",Kapilvastu,37000000,0,0,0.0,0,East,,151,8520 Sq. Feet,0 Feet / Paved,0 Feet , Paved,N/A Sq. Feet,8 months ago,[],24.89408327246165,1486296.9483568075
"House For Sale In Gothatar, Kathmandu","Gothatar, Gothatar, Kathmandu",Kathmandu,36000000,0,0,,0,South,,255,0-6-3-0 Aana,20 Feet / Gravelled,20 Feet , Gravelled,N/A Aana,8 months ago,[],1.6875,21333333.333333332
"House For Sale In Kadaghari, Kathmandu","Gandhi Adarsha H. S. School/College, Kadaghari, Kathmandu",Kathmandu,13200000,7,0,2.0,0,North,,414,0-2-2-0 Aana,13 Feet / Gravelled,13 Feet , Gravelled,N/A Sq. Feet,8 months ago,[],0.625,21120000.0
"House For Sale In Kapan, Kathmandu","Ramhity Pragati Chowk, Kapan, Kathmandu",Kathmandu,29000000,18,0,4.0,0,North,,279,0-4-1-0 Aana,32 Feet / Gravelled,32 Feet , Gravelled,N/A Sq. Feet,8 months ago,[],1.0625,27294117.647058822
"House For Rent In Bhaktapur, Bhaktapur","Bhaktapur, Bhaktapur, Bhaktapur",Bhaktapur,80000,5,4,,0,South,,502,2200 Sq. Feet,15 Feet / Blacktopped,15 Feet , Blacktopped,N/A Sq. Feet,8 months ago,[],6.428049671292914,12445.454545454546
"House For Sale In Sitapaila, Kathmandu","Padma colony, Sitapaila, Kathmandu",Kathmandu,20500000,0,0,,0,West,,481,5 Aana,20 Feet / Blacktopped,20 Feet , Blacktopped,N/A Sq. Feet,8 months ago,[],5.0,4100000.0
"House For Sale In Tahachal, Kathmandu","Tahachal, Tahachal, Kathmandu",Kathmandu,27000000,3,4,,1,North,2018.0,452,3.5 Aana,0 Feet,0 Feet,,3 Aana,8 months ago,[],3.0,9000000.0
"Land For Sale In Sanepa, Lalitpur","Jhamsikhel, Sanepa, Lalitpur",Lalitpur,8000000,0,0,,0,West,,310,6 Aana,0 Feet,0 Feet,,N/A Aana,8 months ago,[],6.0,1333333.3333333333
"House For Sale In Balaju, Kathmandu","Balaju, Balaju, Kathmandu",Kathmandu,12000000,0,0,,0,West,,672,0-3-5-0 Aana,26 Feet / Blacktopped,26 Feet , Blacktopped,N/A Sq. Feet,8 months ago,[],1.0625,11294117.647058824
"House For Sale In Imadol, Lalitpur","Imadol, Imadol, Lalitpur",Lalitpur,19500000,5,3,3.0,0,North,2076.0,1.4K,0-3-2-0 Aana,13 Feet / Gravelled,13 Feet , Gravelled,N/A Aana,8 months ago,[],0.875,22285714.285714287
"Flat For Rent In Biratnagar, Morang","Biratnagar, Biratnagar, Morang",Morang,15000,3,1,,0,North,,265,1300 Sq. Feet,13 Feet / Gravelled,13 Feet , Gravelled,N/A Sq. Feet,8 months ago,[],3.7983929875821767,3949.0384615384614
"Office Space For Rent In Tinkune, Kathmandu","Tinkune Park, Tinkune, Kathmandu",Kathmandu,25000,0,0,,0,North,,384,1000 Sq. Feet,0 Feet,0 Feet,,N/A Sq. Feet,8 months ago,[],2.9218407596785974,8556.25
"House For Sale In Basundhara, Kathmandu","HERALD INT'L COLLEGE & H.S.S., Basundhara, Kathmandu",Kathmandu,19500000,0,0,,0,North,,524,0-3-5-0 Aana,13 Feet / Blacktopped,13 Feet , Blacktopped,N/A Sq. Feet,8 months ago,[],1.0625,18352941.17647059
"Land For Sale In Dhobighat, Lalitpur","Sunrise Towers, Dhobighat, Lalitpur",Lalitpur,3700000,0,0,,0,East,,530,4 Aana,5 Feet / Blacktopped,5 Feet , Blacktopped,N/A Aana,8 months ago,[],4.0,925000.0
"Land For Sale In Sankhu, Kathmandu","Sankhu Road, Sankhu, Kathmandu",Kathmandu,1350000,0,0,,0,North,,179,10 Aana,13 Feet / Soil Stabilized,13 Feet , Soil Stabilized,N/A Sq. Feet,8 months ago,[],10.0,135000.0
"Land For Sale In Boudha, Kathmandu","Townplanning, Boudha, Kathmandu",Kathmandu,3700000,0,0,,0,West,,251,4 Aana,12 Feet / Gravelled,12 Feet , Gravelled,N/A Sq. Feet,8 months ago,[],4.0,925000.0
"Land For Sale : Land For Sale In Chandragiri, Kathmandu","chekpost ,thankot ,chandragiri, Chandragiri, Kathmandu",Kathmandu,1500000,0,0,,0,West,,493,0-4-0-0 Aana,20 Feet / Blacktopped,20 Feet , Blacktopped,N/A Aana,8 months ago,[],1.0,1500000.0
"Land For Sale : Land For Sale In Chandragiri, Kathmandu","cable car bottom station, Chandragiri, Kathmandu",Kathmandu,1600000,0,0,,0,East,,449,0-5-0-1 Aana,13 Feet / Blacktopped,13 Feet , Blacktopped,N/A Aana,8 months ago,[],1.265625,1264197.5308641975
"Land For Sale In Patan, Lalitpur","Chyasal gate, Patan, Lalitpur",Lalitpur,4000000,0,0,,0,North,,267,3 Ropani,20 Feet / Blacktopped,20 Feet , Blacktopped,N/A Ropani,8 months ago,[],48.0,83333.33333333333
"Land For Sale In Koteshwor, Kathmandu","Koteshwor, Koteshwor, Kathmandu",Kathmandu,5000000,0,0,,0,South,,210,1 Ropani,20 Feet / Blacktopped,20 Feet , Blacktopped,N/A Ropani,8 months ago,[],16.0,312500.0
"House For Sale In Kapan, Kathmandu","Jyoti Nagar Road, Kapan, Kathmandu",Kathmandu,26500000,11,5,3.0,0,East,,253,4 Aana,13 Feet / Blacktopped,13 Feet , Blacktopped,N/A Sq. Feet,8 months ago,[],4.0,6625000.0
"House For Sale In Kapan, Kathmandu","Valley Public H.S. School, Kapan, Kathmandu",Kathmandu,25500000,11,0,3.0,0,North,,2.2K,0-4-0-0 Aana,13 Feet / Blacktopped,13 Feet , Blacktopped,N/A Sq. Feet,8 months ago,[],1.0,25500000.0
"House For Sale In Naikap, Kathmandu","Naikap Naya Bhanjyang, Naikap, Kathmandu",Kathmandu,29500000,5,2,3.0,1,South,2067.0,1.9K,0-6-3-3 Aana,15 Feet / Blacktopped,15 Feet , Blacktopped,N/A Aana,8 months ago,"['Balcony', 'Garden', 'TV Cable', 'Drainage', 'Water Supply', 'Solar Water', 'Water Tank', 'Water Well', 'Internet', 'Parking', 'Store Room']",1.734375,17009009.009009007
"House For Sale In Sukedhara Ektabasti : House For Sale In Budhanilkantha, Kathmandu","Sukedhara, Budhanilkantha, Kathmandu",Kathmandu,23500000,0,3,3.0,2,East,2018.0,530,4.1 Aana,13 Feet / Blacktopped,13 Feet , Blacktopped,3.5 Aana,8 months ago,['Balcony'],4.0,5875000.0
"House For Sale In Imadol, Lalitpur","Nayabasti, Imadol, Lalitpur",Lalitpur,15000000,4,3,3.0,0,South,,998,0-2-2-0 Aana,13 Feet / Gravelled,13 Feet , Gravelled,N/A Sq. Feet,8 months ago,[],0.625,24000000.0
"House For Sale In Imadol, Lalitpur","Krishna Temple, Imadol, Lalitpur",Lalitpur,19000000,4,3,3.0,0,South East,,587,0-3-0-3 Aana,10 Feet / Gravelled,10 Feet , Gravelled,N/A Sq. Feet,8 months ago,[],0.796875,23843137.25490196
"House For Sale In Imadol, Lalitpur","Nayabasti, Imadol, Lalitpur",Lalitpur,15000000,4,3,3.0,0,South,,1K,0-2-2-0 Aana,13 Feet / Gravelled,13 Feet , Gravelled,N/A Aana,8 months ago,[],0.625,24000000.0
"Business For Sale In Basantapur, Kathmandu","Basantapur Durbar Square, Basantapur, Kathmandu",Kathmandu,1700000,0,0,,0,South East,,1.9K,200 Sq. Feet,30 Feet / Blacktopped,30 Feet , Blacktopped,N/A Sq. Feet,8 months ago,[],0.5843681519357194,2909125.0000000005
"House For Sale In Imadol, Lalitpur","Imadol Swimming Pool, Imadol, Lalitpur",Lalitpur,23500000,4,3,3.0,0,South,,300,0-3-3-0 Aana,20 Feet / Gravelled,20 Feet , Gravelled,N/A Sq. Feet,8 months ago,"['Balcony', 'Modular Kitchen', 'Wifi', 'Drainage', 'Water Tank', 'Parking']",0.9375,25066666.666666668
"House For Sale In Imadol, Lalitpur","Nayabasti, Imadol, Lalitpur",Lalitpur,18000000,5,4,3.0,0,North West,,4.1K,3 Aana,11 Feet / Gravelled,11 Feet , Gravelled,N/A Sq. Feet,8 months ago,"['Balcony', 'Modular Kitchen', 'Wifi', 'Drainage', 'Water Tank', 'Water Well', 'Parking']",3.0,6000000.0
"House For Sale In Imadol, Lalitpur","Korean Church, Imadol, Lalitpur",Lalitpur,18500000,3,3,3.0,2,South,2076.0,2K,0-3-1-0 Aana,13 Feet / Gravelled,13 Feet , Gravelled,N/A Aana,8 months ago,"['Balcony', 'Modular Kitchen', 'TV Cable', 'Wifi', 'Drainage', 'Water Tank', 'Water Well', 'Internet', 'Parking']",0.8125,22769230.769230768
"House For Sale In Itahari, Sunsari","Itahari, Itahari, Sunsari",Sunsari,15000000,0,0,,0,North,,312,9 Dhur,20 Feet / Blacktopped,20 Feet , Blacktopped,N/A Sq. Feet,8 months ago,[],3.051,4916420.845624385
"House For Sale In Tokha, Kathmandu","Panchetar, Tokha, Kathmandu",Kathmandu,24500000,7,3,3.0,0,South East,,301,0-4-2-0 Aana,10 Feet / Gravelled,10 Feet , Gravelled,N/A Sq. Feet,8 months ago,[],1.125,21777777.777777776
"House For Sale In Baneshwor, Kathmandu","Buddhanagar, Baneshwor, Kathmandu",Kathmandu,33000000,0,0,3.0,3,South,,4.3K,0-4-2-0 Aana,8 Feet / Gravelled,8 Feet , Gravelled,N/A Sq. Feet,8 months ago,[],1.125,29333333.333333332
"6 Aana Land Sale At Minbhawan : Land For Sale In Minbhawan, Kathmandu","Aloknagar, Minbhawan, Kathmandu",Kathmandu,6500000,0,0,,0,South East,,268,0-6-0-0 Aana,20 Feet,20 Feet,,N/A Aana,8 months ago,[],1.5,4333333.333333333
"Shankhamul 12 Aana Land Sale : Land For Sale In Baneshwor, Kathmandu","Shankhamul, Baneshwor, Kathmandu",Kathmandu,6500000,0,0,,0,East,,324,0-12-0-0 Aana,20 Feet,20 Feet,,N/A Aana,8 months ago,[],3.0,2166666.6666666665
"12 Aana Land Dhobighat : Land For Sale In Dhobighat, Lalitpur","Thadodhunga, Dhobighat, Lalitpur",Lalitpur,6500000,0,0,,0,North,,312,0-12-0-0 Aana,20 Feet,20 Feet,,N/A Aana,8 months ago,[],3.0,2166666.6666666665
"Land For Sale In Sanepa, Lalitpur","Sanepa, Sanepa, Lalitpur",Lalitpur,5500000,0,0,,0,South East,,248,1-0-0-0 Aana,13 Feet,13 Feet,,N/A Aana,8 months ago,[],1.0,5500000.0
"House For Sale In Damak, Jhapa","Damak, Damak, Jhapa",Jhapa,19000000,0,0,2.0,0,East,,300,21 Dhur,15 Feet / Gravelled,15 Feet , Gravelled,N/A Dhur,8 months ago,[],7.119000000000001,2668914.173338952
"48lak House Cheap : House For Sale In Sanepa, Lalitpur","sanepa, Sanepa, Lalitpur",Lalitpur,4800000,2,1,1.0,1,West,2018.0,859,3 Aana,13 Feet / Gravelled,13 Feet , Gravelled,540 Sq. Feet,8 months ago,"['Garden', 'Modular Kitchen', 'Wifi', 'Water Tank', 'Water Well', 'Water Supply', 'Electricity Backup', 'Internet', 'Kids Playground']",3.0,1600000.0
"Business For Sale In Hattigauda, Kathmandu","Hattigauda, Hattigauda, Kathmandu",Kathmandu,900000,0,0,,0,East,,207,400 Sq. Feet,15 Feet / Blacktopped,15 Feet , Blacktopped,N/A Sq. Feet,8 months ago,[],1.168736303871439,770062.5000000001
"House For Sale In Changunarayan, Bhaktapur","Jhaukhel, Changunarayan, Bhaktapur",Bhaktapur,21500000,0,0,3.5,0,West,,165,7 Aana,15 Feet / Gravelled,15 Feet , Gravelled,N/A Sq. Feet,8 months ago,[],7.0,3071428.5714285714
"House For Sale In Dhapakhel, Lalitpur","Dhapakhel, Dhapakhel, Lalitpur",Lalitpur,26000000,0,0,,0,South,,205,0-4-5-0 Aana,12 Feet / Blacktopped,12 Feet , Blacktopped,N/A Sq. Feet,8 months ago,[],1.3125,19809523.80952381
"Land For Sale In Tikathali, Lalitpur","Tikathali, Tikathali, Lalitpur",Lalitpur,2300000,0,0,,0,South,,370,0-3-1-0 Aana,13 Feet / Soil Stabilized,13 Feet , Soil Stabilized,N/A Sq. Feet,8 months ago,[],0.8125,2830769.230769231
"House For Sale In Damak, Jhapa","Damak, Damak, Jhapa",Jhapa,20000000,4,1,2.0,3,South,,773,10 Aana,20 Feet / Blacktopped,20 Feet , Blacktopped,N/A Sq. Feet,8 months ago,[],10.0,2000000.0
"Modern House For Sale At Budhanilkantha : House For Sale In Budhanilkantha, Kathmandu","Taulung road, Budhanilkantha, Kathmandu",Kathmandu,51000000,5,5,2.0,0,East,2011.0,240,14 Aana,14 Feet / Blacktopped,14 Feet , Blacktopped,N/A Aana,8 months ago,"['Lawn', 'Balcony', 'Fencing', 'Garden', 'Modular Kitchen', 'TV Cable', 'Drainage', 'Water Supply', 'Solar Water', 'Water Tank', 'Parking', 'Store Room', 'Garage']",14.0,3642857.1428571427
"House On Sale At Nakkhu : House For Sale In Nakkhu, Lalitpur","Nakkhu, Nakkhu, Lalitpur",Lalitpur,26500000,4,4,2.0,1,East,2075.0,227,0-4-0-0 Aana,16 Feet / Gravelled,16 Feet , Gravelled,820 Sq. Feet,8 months ago,"['Garage', 'Drainage', 'TV Cable', 'Balcony', 'Store Room', 'Water Well', 'Frontyard', 'Parking', 'Internet', 'Water Tank', 'Garden', 'Modular Kitchen']",1.0,26500000.0
"2.5 Stories Beautiful House In Dhobhighat : House For Sale In Dhobighat, Lalitpur","Dhobighat, Dhobighat, Lalitpur",Lalitpur,29500000,5,3,,4,East,,315,4 Aana,0 Feet,0 Feet,,N/A Aana,8 months ago,"['Balcony', 'Fencing', 'Garden', 'TV Cable', 'Wifi', 'Water Supply', 'Water Tank', 'Water Well', 'Internet', 'Kids Playground']",4.0,7375000.0
"Residential Land : Land For Sale In Hetauda, Makwanpur","Gauritaar, Hetauda, Makwanpur",Makwanpur,200000,0,0,,0,East,,295,14 Dhur,8 Meter / Blacktopped,8 Meter , Blacktopped,N/A Dhur,8 months ago,[],4.746,42140.75010535187
"Commercial Land On Sale At Deep, Pokhara. : Land For Sale In Birendra Chowk, Pokhara","Tallo Deep, Birendra Chowk, Pokhara",Pokhara,15000000,0,0,,0,South West,,220,1-5-0-0 Aana,30 Feet / Blacktopped,30 Feet , Blacktopped,N/A Aana,8 months ago,[],2.25,6666666.666666667
"Residential Land In Hetauda, Karra : Land For Sale In Hetauda, Makwanpur","Karra, Hetauda, Makwanpur",Makwanpur,650000,0,0,,0,East,,226,10 Dhur,8 Meter / Paved,8 Meter , Paved,N/A Dhur,8 months ago,[],3.39,191740.41297935104
"Residential Land In Swayambhu : Land For Sale In Swayambhu, Kathmandu","Swayambhu, Swayambhu, Kathmandu",Kathmandu,1600000,0,0,,0,East,,599,0-3-0-0 Aana,12 Feet / Gravelled,12 Feet , Gravelled,N/A Aana,8 months ago,[],0.75,2133333.3333333335
"4 Aana, Mulpani, Residential Land, South Facing : Land For Sale In Mulpani, Kathmandu","Near Mulpani Chaur, Mulpani, Kathmandu",Kathmandu,1600000,0,0,,0,South,,309,4 Aana,10 Feet / Gravelled,10 Feet , Gravelled,N/A Aana,8 months ago,[],4.0,400000.0
"House For Sale In Budhanilkantha, Kathmandu","RudreshworChowk, Budhanilkantha, Kathmandu",Kathmandu,15000000,2,3,3.0,1,West,2012.0,409,3 Aana,12 Feet / Soil Stabilized,12 Feet , Soil Stabilized,2.6 Aana,8 months ago,"['Lawn', 'Backyard', 'Balcony', 'Garden', 'Fencing', 'Modular Kitchen', 'TV Cable', 'Drainage', 'Solar Water', 'Water Supply']",3.0,5000000.0
"House For Sale InKhusibun, Naya Bazar, Kathmandu","Nabazar Khusibun, Naya Bazar, Kathmandu",Kathmandu,40000000,3,4,3.0,1,East,2075.0,267,0-3-0-0 Aana,20 Feet,20 Feet,,N/A Aana,8 months ago,[],0.75,53333333.333333336
"House On Sale @ Very Low Price : House For Sale In Mulpani, Kathmandu","Dumakhal, Mulpani, Kathmandu",Kathmandu,17500000,6,2,3.0,1,East,2007.0,433,11 Aana,20 Feet / Gravelled,20 Feet , Gravelled,4 Aana,8 months ago,"['Balcony', 'Backyard', 'TV Cable', 'Water Supply', 'Solar Water', 'Water Well']",11.0,1590909.0909090908
"House For Sale In Manamaiju, Kathmandu","BASUKI NAG TOLE, Manamaiju, Kathmandu",Kathmandu,13500000,4,3,3.0,0,East,2075.0,388,2-2 Aana,10 Feet / Blacktopped,10 Feet , Blacktopped,2-1 Aana,8 months ago,[],2.0,6750000.0
